[
  {
    "id": "S2-0121",
    "chapter": "S2",
    "topic": "function-arguments",
    "tags": [
      "default-values"
    ],
    "type": "single",
    "difficulty": 1,
    "source": "generated",
    "stem": "What is the output of the following code?",
    "code": "def greet(name, msg='Hello'):\n    return msg + ' ' + name\n\nprint(greet('Ann'), greet('Bob', 'Hi'))",
    "options": [
      {
        "id": "a",
        "text": "Hello Ann Hi Bob",
        "mono": true
      },
      {
        "id": "b",
        "text": "Hello Ann Hello Bob",
        "mono": true
      },
      {
        "id": "c",
        "text": "Ann Hello Bob Hi",
        "mono": true
      },
      {
        "id": "d",
        "text": "TypeError",
        "out": "!TypeError"
      }
    ],
    "correct": [
      "a"
    ],
    "explanation": "A default value is used only when the argument is omitted: the first call uses 'Hello', the second replaces it with 'Hi'.",
    "distractor_notes": {
      "b": "An explicit argument replaces the default value.",
      "c": "The function returns msg + ' ' + name: msg comes first.",
      "d": "msg has a default value, so greet('Ann') is a valid call."
    },
    "slides": [
      82
    ],
    "verify": {
      "mode": "output"
    },
    "reviewed": 2
  },
  {
    "id": "S2-0122",
    "chapter": "S2",
    "topic": "function-arguments",
    "tags": [
      "default-values",
      "parameter-order",
      "SyntaxError"
    ],
    "type": "single",
    "difficulty": 2,
    "source": "generated",
    "stem": "What happens when the following code is run?",
    "code": "def power(base=2, exp):\n    return base ** exp\n\nprint(power(3))",
    "options": [
      {
        "id": "a",
        "text": "8",
        "mono": true
      },
      {
        "id": "b",
        "text": "9",
        "mono": true
      },
      {
        "id": "c",
        "text": "SyntaxError",
        "out": "!SyntaxError"
      },
      {
        "id": "d",
        "text": "TypeError",
        "out": "!TypeError"
      }
    ],
    "correct": [
      "c"
    ],
    "explanation": "Ordinary (positional) parameters with default values must come **after** the parameters without defaults. This `def` is rejected when the code is compiled (SyntaxError), so nothing runs.",
    "distractor_notes": {
      "a": "The definition itself is invalid; Python does not guess that 3 is meant for exp.",
      "b": "The code never runs: the def line is a syntax error.",
      "d": "The problem is detected at compile time (SyntaxError), not when the function is called."
    },
    "slides": [
      82
    ],
    "verify": {
      "mode": "output"
    },
    "reviewed": 2
  },
  {
    "id": "S2-0123",
    "chapter": "S2",
    "topic": "function-arguments",
    "tags": [
      "keyword-arguments",
      "SyntaxError"
    ],
    "type": "single",
    "difficulty": 2,
    "source": "generated",
    "stem": "What will be the output of the code?",
    "code": "def f(a, b, c):\n    return a + b + c\n\nprint(f(1, b=2, 3))",
    "options": [
      {
        "id": "a",
        "text": "6",
        "mono": true
      },
      {
        "id": "b",
        "text": "None",
        "mono": true
      },
      {
        "id": "c",
        "text": "TypeError",
        "out": "!TypeError"
      },
      {
        "id": "d",
        "text": "SyntaxError",
        "out": "!SyntaxError"
      }
    ],
    "correct": [
      "d"
    ],
    "explanation": "In a call, all positional arguments must come before the keyword arguments. `f(1, b=2, 3)` is a SyntaxError (positional argument follows keyword argument).",
    "distractor_notes": {
      "a": "Python does not assign 3 to c after a keyword argument.",
      "b": "The program does not run at all.",
      "c": "The call is rejected at compile time, before running: it is a SyntaxError."
    },
    "slides": [
      82
    ],
    "verify": {
      "mode": "output"
    },
    "reviewed": 2
  },
  {
    "id": "S2-0124",
    "chapter": "S2",
    "topic": "function-arguments",
    "tags": [
      "keyword-arguments",
      "TypeError"
    ],
    "type": "single",
    "difficulty": 3,
    "source": "generated",
    "stem": "What is the output of the following code?",
    "code": "def f(a, b=5):\n    return a * b\n\nprint(f(2, a=3))",
    "options": [
      {
        "id": "a",
        "text": "6",
        "mono": true
      },
      {
        "id": "b",
        "text": "TypeError",
        "out": "!TypeError"
      },
      {
        "id": "c",
        "text": "15",
        "mono": true
      },
      {
        "id": "d",
        "text": "SyntaxError",
        "out": "!SyntaxError"
      }
    ],
    "correct": [
      "b"
    ],
    "explanation": "The positional 2 is bound to `a`, then the keyword `a=3` tries to bind `a` again: TypeError (f() got multiple values for argument 'a'). The call itself is valid syntax (keyword after positional).",
    "distractor_notes": {
      "a": "2 is not passed to b: positional arguments fill the parameters from the left.",
      "c": "a cannot receive both 2 and 3.",
      "d": "Positional-then-keyword order is valid syntax; the error happens at run time."
    },
    "slides": [
      82
    ],
    "verify": {
      "mode": "output"
    },
    "reviewed": 2
  },
  {
    "id": "S2-0125",
    "chapter": "S2",
    "topic": "function-arguments",
    "tags": [
      "missing-argument",
      "TypeError"
    ],
    "type": "single",
    "difficulty": 1,
    "source": "generated",
    "stem": "Find the output of the code?",
    "code": "def area(w, h):\n    return w * h\n\nprint(area(4))",
    "options": [
      {
        "id": "a",
        "text": "TypeError",
        "out": "!TypeError"
      },
      {
        "id": "b",
        "text": "16",
        "mono": true
      },
      {
        "id": "c",
        "text": "0",
        "mono": true
      },
      {
        "id": "d",
        "text": "4",
        "mono": true
      }
    ],
    "correct": [
      "a"
    ],
    "explanation": "h has no default value, so calling `area` with a single argument raises TypeError (missing 1 required positional argument: 'h').",
    "distractor_notes": {
      "b": "Python does not reuse w for h.",
      "c": "Missing arguments do not default to 0.",
      "d": "Missing arguments are not ignored."
    },
    "slides": [
      82
    ],
    "verify": {
      "mode": "output"
    },
    "reviewed": 2
  },
  {
    "id": "S2-0126",
    "chapter": "S2",
    "topic": "function-arguments",
    "tags": [
      "keyword-arguments",
      "default-values"
    ],
    "type": "single",
    "difficulty": 1,
    "source": "generated",
    "stem": "What is the output of the following code?",
    "code": "def describe(name, age, city='Paris'):\n    print(name, age, city)\n\ndescribe(age=30, city='Lyon', name='Eva')",
    "options": [
      {
        "id": "a",
        "text": "SyntaxError",
        "out": "!SyntaxError"
      },
      {
        "id": "b",
        "text": "30 Lyon Eva",
        "mono": true
      },
      {
        "id": "c",
        "text": "Eva 30 Paris",
        "mono": true
      },
      {
        "id": "d",
        "text": "Eva 30 Lyon",
        "mono": true
      }
    ],
    "correct": [
      "d"
    ],
    "explanation": "Keyword arguments are matched by name, so their order in the call does not matter; city='Lyon' replaces the default value.",
    "distractor_notes": {
      "a": "Keyword arguments may be given in any order.",
      "b": "Keyword arguments go to the parameter with that name, not by position.",
      "c": "The default is replaced by the value passed."
    },
    "slides": [
      82
    ],
    "verify": {
      "mode": "output"
    },
    "reviewed": 2
  },
  {
    "id": "S2-0127",
    "chapter": "S2",
    "topic": "function-arguments",
    "tags": [
      "function-as-argument"
    ],
    "type": "single",
    "difficulty": 1,
    "source": "generated",
    "stem": "What is the output of the following code?",
    "code": "def apply(func, x):\n    return func(func(x))\n\ndef inc(n):\n    return n + 1\n\nprint(apply(inc, 5))",
    "options": [
      {
        "id": "a",
        "text": "7",
        "mono": true
      },
      {
        "id": "b",
        "text": "6",
        "mono": true
      },
      {
        "id": "c",
        "text": "TypeError",
        "out": "!TypeError"
      },
      {
        "id": "d",
        "text": "10",
        "mono": true
      }
    ],
    "correct": [
      "a"
    ],
    "explanation": "Functions are objects that can be passed as arguments. Inside apply, `func` is inc, called twice: inc(inc(5)) = inc(6) = 7.",
    "distractor_notes": {
      "b": "func is applied twice.",
      "c": "Passing a function (its name, without parentheses) is allowed.",
      "d": "inc adds 1 (5 -> 6 -> 7); it does not double."
    },
    "slides": [
      81
    ],
    "verify": {
      "mode": "output"
    },
    "reviewed": 2
  },
  {
    "id": "S2-0128",
    "chapter": "S2",
    "topic": "function-arguments",
    "tags": [
      "function-as-argument",
      "TypeError"
    ],
    "type": "single",
    "difficulty": 3,
    "source": "generated",
    "stem": "What will be the output of the code?",
    "code": "def apply(func, x):\n    return func(x)\n\ndef double(n):\n    return 2 * n\n\nprint(apply(double(3), 4))",
    "options": [
      {
        "id": "a",
        "text": "8",
        "mono": true
      },
      {
        "id": "b",
        "text": "TypeError",
        "out": "!TypeError"
      },
      {
        "id": "c",
        "text": "6",
        "mono": true
      },
      {
        "id": "d",
        "text": "24",
        "mono": true
      }
    ],
    "correct": [
      "b"
    ],
    "explanation": "`double(3)` is evaluated first, so apply receives the **int** 6, not the function. Inside apply, `func(x)` becomes `6(4)`, which raises TypeError: 'int' object is not callable. Pass `double` without parentheses.",
    "distractor_notes": {